{
  "suite_id": "context-surfacing-suite",
  "title": "Context Surfacing Marker Suite",
  "scenario_count": 6,
  "pair_count": 8,
  "metrics": {
    "baseline_pass_rate": 0,
    "treatment_pass_rate": 0.875,
    "improvement_rate": 0.875,
    "baseline_false_positive_rate": 0.375,
    "treatment_false_positive_rate": 0,
    "median_treatment_latency": 1,
    "p95_treatment_latency": 2,
    "pass_at_1": 1,
    "pass_at_k": 1,
    "pass_pow_k": 0.8333333333333334
  },
  "benchmarks": [
    {
      "benchmark_id": "migration-marker",
      "title": "Migration marker",
      "marker_class": "data-migration",
      "repo_surface": "db/schema.prisma",
      "trial_count": 1,
      "metrics": {
        "baseline_pass_rate": 0,
        "treatment_pass_rate": 1,
        "improvement_rate": 1,
        "baseline_false_positive_rate": 1,
        "treatment_false_positive_rate": 0,
        "median_treatment_latency": 1,
        "p95_treatment_latency": 1,
        "pass_at_1": 1,
        "pass_at_k": 1,
        "pass_pow_k": 1
      },
      "trials": [
        {
          "trial_id": "migration-trial-1",
          "comparison": {
            "benchmark_id": "migration-marker",
            "title": "Migration marker surfaces on the first relevant response",
            "scoring_window_assistant_turns": 1,
            "conditions": {
              "without_veritas": {
                "run_id": "without-veritas-run",
                "condition_id": "without-veritas",
                "trigger_seen": true,
                "trigger_turn": 3,
                "response_window_tag_used": true,
                "first_response_window_turn": 4,
                "first_surface_turn": 5,
                "assistant_turn_latency": 2,
                "surfaced": true,
                "timely": false,
                "false_positive": true,
                "matched_phrase": "run a migration",
                "pass": false
              },
              "with_veritas": {
                "run_id": "with-veritas-run",
                "condition_id": "with-veritas",
                "trigger_seen": true,
                "trigger_turn": 2,
                "response_window_tag_used": true,
                "first_response_window_turn": 3,
                "first_surface_turn": 3,
                "assistant_turn_latency": 1,
                "surfaced": true,
                "timely": true,
                "false_positive": false,
                "matched_phrase": "data migration",
                "pass": true
              }
            },
            "comparison": {
              "timely_recall_delta": 1,
              "false_positive_improvement": 1,
              "latency_improvement_turns": 1,
              "treatment_beats_baseline": true
            }
          }
        }
      ]
    },
    {
      "benchmark_id": "auth-boundary-marker",
      "title": "Auth boundary marker",
      "marker_class": "authorization-boundary",
      "repo_surface": "src/auth/policy.ts",
      "trial_count": 3,
      "metrics": {
        "baseline_pass_rate": 0,
        "treatment_pass_rate": 0.6666666666666666,
        "improvement_rate": 0.6666666666666666,
        "baseline_false_positive_rate": 0.3333333333333333,
        "treatment_false_positive_rate": 0,
        "median_treatment_latency": 1,
        "p95_treatment_latency": 2,
        "pass_at_1": 1,
        "pass_at_k": 1,
        "pass_pow_k": 0
      },
      "trials": [
        {
          "trial_id": "auth-trial-1",
          "comparison": {
            "benchmark_id": "auth-boundary-marker",
            "title": "Authorization boundary marker surfaces on the tagged response",
            "scoring_window_assistant_turns": 1,
            "conditions": {
              "without_veritas": {
                "run_id": "auth-without-1",
                "condition_id": "without-veritas",
                "trigger_seen": true,
                "trigger_turn": 1,
                "response_window_tag_used": true,
                "first_response_window_turn": 2,
                "first_surface_turn": 3,
                "assistant_turn_latency": 2,
                "surfaced": true,
                "timely": false,
                "false_positive": false,
                "matched_phrase": "permission check",
                "pass": false
              },
              "with_veritas": {
                "run_id": "auth-with-1",
                "condition_id": "with-veritas",
                "trigger_seen": true,
                "trigger_turn": 1,
                "response_window_tag_used": true,
                "first_response_window_turn": 2,
                "first_surface_turn": 2,
                "assistant_turn_latency": 1,
                "surfaced": true,
                "timely": true,
                "false_positive": false,
                "matched_phrase": "permission check",
                "pass": true
              }
            },
            "comparison": {
              "timely_recall_delta": 1,
              "false_positive_improvement": 0,
              "latency_improvement_turns": 1,
              "treatment_beats_baseline": true
            }
          }
        },
        {
          "trial_id": "auth-trial-2",
          "comparison": {
            "benchmark_id": "auth-boundary-marker",
            "title": "Authorization boundary marker surfaces on the tagged response",
            "scoring_window_assistant_turns": 1,
            "conditions": {
              "without_veritas": {
                "run_id": "auth-without-2",
                "condition_id": "without-veritas",
                "trigger_seen": true,
                "trigger_turn": 2,
                "response_window_tag_used": true,
                "first_response_window_turn": 3,
                "first_surface_turn": null,
                "assistant_turn_latency": null,
                "surfaced": false,
                "timely": false,
                "false_positive": true,
                "matched_phrase": null,
                "pass": false
              },
              "with_veritas": {
                "run_id": "auth-with-2",
                "condition_id": "with-veritas",
                "trigger_seen": true,
                "trigger_turn": 1,
                "response_window_tag_used": true,
                "first_response_window_turn": 2,
                "first_surface_turn": 2,
                "assistant_turn_latency": 1,
                "surfaced": true,
                "timely": true,
                "false_positive": false,
                "matched_phrase": "permission check",
                "pass": true
              }
            },
            "comparison": {
              "timely_recall_delta": 1,
              "false_positive_improvement": 1,
              "latency_improvement_turns": null,
              "treatment_beats_baseline": true
            }
          }
        },
        {
          "trial_id": "auth-trial-3",
          "comparison": {
            "benchmark_id": "auth-boundary-marker",
            "title": "Authorization boundary marker surfaces on the tagged response",
            "scoring_window_assistant_turns": 1,
            "conditions": {
              "without_veritas": {
                "run_id": "auth-without-3",
                "condition_id": "without-veritas",
                "trigger_seen": true,
                "trigger_turn": 1,
                "response_window_tag_used": true,
                "first_response_window_turn": 2,
                "first_surface_turn": null,
                "assistant_turn_latency": null,
                "surfaced": false,
                "timely": false,
                "false_positive": false,
                "matched_phrase": null,
                "pass": false
              },
              "with_veritas": {
                "run_id": "auth-with-3",
                "condition_id": "with-veritas",
                "trigger_seen": true,
                "trigger_turn": 1,
                "response_window_tag_used": true,
                "first_response_window_turn": 2,
                "first_surface_turn": 3,
                "assistant_turn_latency": 2,
                "surfaced": true,
                "timely": false,
                "false_positive": false,
                "matched_phrase": "permission check",
                "pass": false
              }
            },
            "comparison": {
              "timely_recall_delta": 0,
              "false_positive_improvement": 0,
              "latency_improvement_turns": null,
              "treatment_beats_baseline": false
            }
          }
        }
      ]
    },
    {
      "benchmark_id": "pii-marker",
      "title": "PII marker",
      "marker_class": "privacy",
      "repo_surface": "src/api/patients.ts",
      "trial_count": 1,
      "metrics": {
        "baseline_pass_rate": 0,
        "treatment_pass_rate": 1,
        "improvement_rate": 1,
        "baseline_false_positive_rate": 0,
        "treatment_false_positive_rate": 0,
        "median_treatment_latency": 1,
        "p95_treatment_latency": 1,
        "pass_at_1": 1,
        "pass_at_k": 1,
        "pass_pow_k": 1
      },
      "trials": [
        {
          "trial_id": "pii-trial-1",
          "comparison": {
            "benchmark_id": "pii-marker",
            "title": "PII handling marker surfaces on the tagged response",
            "scoring_window_assistant_turns": 1,
            "conditions": {
              "without_veritas": {
                "run_id": "pii-without-1",
                "condition_id": "without-veritas",
                "trigger_seen": true,
                "trigger_turn": 1,
                "response_window_tag_used": true,
                "first_response_window_turn": 2,
                "first_surface_turn": null,
                "assistant_turn_latency": null,
                "surfaced": false,
                "timely": false,
                "false_positive": false,